# name: test/sql/table_changes/ducklake_table_deletions.test
# description: test ducklake_table_deletions function
# group: [table_changes]

require ducklake

require parquet

test-env DUCKLAKE_CONNECTION __TEST_DIR__/{UUID}.db

test-env DATA_PATH __TEST_DIR__


statement ok
ATTACH 'ducklake:${DUCKLAKE_CONNECTION}' AS ducklake (DATA_PATH '${DATA_PATH}/ducklake_table_deletions_files', CATALOG 'test')

# snapshot 1
statement ok
CREATE TABLE ducklake.test(i INTEGER);

# snapshot 2
statement ok
INSERT INTO ducklake.test VALUES (1)

# snapshot 3
statement ok
INSERT INTO ducklake.test VALUES (2)

# snapshot 4
statement ok
INSERT INTO ducklake.test VALUES (3)

# snapshot 5
statement ok
INSERT INTO ducklake.test VALUES (NULL)

# snapshot 6
statement ok
INSERT INTO ducklake.test FROM range(10, 15)

# snapshot 7
statement ok
DELETE FROM ducklake.test WHERE i=2

# snapshot 8
statement ok
DELETE FROM ducklake.test WHERE i=11

# snapshot 9
statement ok
DELETE FROM ducklake.test WHERE i=12

query I
FROM ducklake.test ORDER BY ALL
----
1
3
10
13
14
NULL

# snapshot 7 deleted i=2
query III
SELECT rowid, snapshot_id, * FROM ducklake_table_deletions('ducklake', 'main', 'test', 7, 7);
----
1	7	2

# snapshot 8 deleted i=11
query III
SELECT rowid, snapshot_id, * FROM ducklake_table_deletions('ducklake', 'main', 'test', 8, 8);
----
5	8	11

# snapshot 9 deleted i=12
query III
SELECT rowid, snapshot_id, * FROM ducklake_table_deletions('ducklake', 'main', 'test', 9, 9);
----
6	9	12

# we can get all of these at once
query III
SELECT rowid, snapshot_id, * FROM ducklake_table_deletions('ducklake', 'main', 'test', 7, 9) ORDER BY rowid
----
1	7	2
5	8	11
6	9	12

# this shows all deletions performed
query II
SELECT rowid, * FROM ducklake_table_deletions('ducklake', 'main', 'test', 0, 9) ORDER BY rowid
----
1	2
5	11
6	12

# snapshot 10: update a subset of the rows
statement ok
UPDATE ducklake.test SET i=i+100 WHERE i < 13

# updates are deletions + insertions
query II
SELECT rowid, * FROM ducklake_table_deletions('ducklake', 'main', 'test', 10, 10) ORDER BY rowid
----
0	1
2	3
4	10

# these are all the deleted tuples
query II
SELECT rowid, * FROM ducklake_table_deletions('ducklake', 'main', 'test', 7, 10) ORDER BY rowid
----
0	1
1	2
2	3
4	10
5	11
6	12

statement ok
DELETE FROM ducklake.test

query II
SELECT rowid, * FROM ducklake_table_deletions('ducklake', 'main', 'test', 11, 11) ORDER BY rowid
----
0	101
2	103
3	NULL
4	110
7	13
8	14


# if we update and then delete - the same row can be there multiple times
query II
SELECT rowid, * FROM ducklake_table_deletions('ducklake', 'main', 'test', 0, 11) ORDER BY ALL
----
0	1
0	101
1	2
2	3
2	103
3	NULL
4	10
4	110
5	11
6	12
7	13
8	14
